<?xml version="1.0" encoding="UTF-8"?>
<!--************************************************************************-->
<!--* Copyright (C) 2012 Nicolas Hadacek <hadacek@kde.org>                 *-->
<!--*                                                                      *-->
<!--* This program is free software; you can redistribute it and/or modify *-->
<!--* it under the terms of the GNU General Public License as published by *-->
<!--* the Free Software Foundation; either version 2 of the License, or    *-->
<!--* (at your option) any later version.                                  *-->
<!--************************************************************************-->
<device name="10F320" status="IP" memory_technology="FLASH" self_write="yes" architecture="midrange" id="0x29A0"
        xmlns:xsi='http://www.w3.org/2001/XMLSchema-instance'
        xsi:noNamespaceSchemaLocation='pic.xsd'>

<!--* Documents ************************************************************-->
  <documents webpage="552961" datasheet="41585" progsheet="41572" erratas="80529" />

<!--* Checksums ************************************************************-->
  <checksums>
    <checksum protected="Off" bchecksum="0x1EFF" cchecksum="0xA055" />
    <checksum protected="All" bchecksum="0x372E" cchecksum="0xB854" />
  </checksums>

<!--* Operating characteristics ********************************************-->
  <frequency_range name="extended" >
    <frequency start="0"  end="16" vdd_min="2.3" vdd_max="5.5" />
    <frequency start="16" end="20" vdd_min="2.5" vdd_max="5.5" />
  </frequency_range>

  <voltages name="vpp"      min="8"   max="9"   nominal="8.5" />
  <voltages name="vdd_prog" min="2.7" max="5.5" nominal="5"  />

<!--* Memory ***************************************************************-->
  <memory name="code"               start="0x0000" end="0x00FF" />
  <memory name="calibration"        start="0x2008" end="0x2009" cal_opmask="0x0000" cal_opcode="0x0000"/>
  <memory name="user_ids"           start="0x2000" end="0x2003" rmask="0x000F" />
  <memory name="config"             start="0x2007" end="0x2007" />
  <memory name="device_id"          start="0x2006" end="0x2006" />

<!--* Configuration bits ***************************************************-->
  <config offset="0x0" name="" wmask="0x3FFF" bvalue="0x3FFF" >
    <mask name="FOSC"   value="0x0001" >
      <value value="0x0000" name="INTRC" def="_FOSC_INTOSC" />
      <value value="0x0001" name="EC"     def="_FOSC_EC"     />
    </mask>
    <mask name="BODEN"  value="0x0006" >
      <value value="0x0000" name="Off"      def="_BOREN_OFF"    />
      <value value="0x0002" name="Software" def="_BOREN_SBODEN" />
      <value value="0x0004" name="On_run"   def="_BOREN_NSLEEP" />
      <value value="0x0006" name="On"       def="_BOREN_ON"     />
    </mask>
    <mask name="WDT"    value="0x0018" >
      <value value="0x0000" name="Off"      def="_WDT_OFF"    />
      <value value="0x0008" name="Software" def="_WDT_SWDTEN" />
      <value value="0x0010" name="On_run"   def="_WDT_NSLEEP" />
      <value value="0x0018" name="On"       def="_WDT_ON"     />
    </mask>
    <mask name="PWRTE"  value="0x0020" >
      <value value="0x0000" name="On"  def="_PWRTE_ON"  />
      <value value="0x0020" name="Off" def="_PWRTE_OFF" />
    </mask>
    <mask name="MCLRE"  value="0x0040" >
      <value value="0x0000" name="Internal" def="_MCLRE_OFF" />
      <value value="0x0040" name="External" def="_MCLRE_ON"  />
    </mask>
    <mask name="CP"  value="0x0080" >
      <value value="0x0000" name="All" def="_CP_ON"  />
      <value value="0x0080" name="Off" def="_CP_OFF" />
    </mask>
    <mask name="LVP"  value="0x0100" >
      <value value="0x0000" name="Off" def="_LVP_OFF" />
      <value value="0x0100" name="On"  def="_LVP_ON"  />
    </mask>
    <mask name="LPBOR"  value="0x0200" >
      <value value="0x0000" name="Off" def="_LPBOR_OFF" />
      <value value="0x0200" name="On"  def="_LPBOR_ON"  />
    </mask>
    <mask name="BORV"  value="0x0400" >
      <value value="0x0000" name="2.7" def="_BORV_27" />
      <value value="0x0400" name="2.4" def="_BORV_24"  />
    </mask>
    <mask name="WRT"  value="0x1800" >
      <value value="0x0000" name="000:0FF" def="_WRT_ALL" />
      <value value="0x0800" name="000:07F" def="_WRT_HALF"  />
      <value value="0x1000" name="000:03F" def="_WRT_BOOT"  />
      <value value="0x1800" name="Off"     def="_WRT_OFF"  />
    </mask>
    <mask name="DEBUG"  value="0x2000" >
      <value value="0x0000" name="On"   def="_DEBUG_OFF" />
      <value value="0x2000" name="Off"  def="_DEBUG_ON"  />
    </mask>
  </config>

<!--* Packages *************************************************************-->
  <package types="pdip"  nb_pins="8" >
    <pin index="1" name="N/C"          />
    <pin index="2" name="VDD"          />
    <pin index="3" name="RA2"          />
    <pin index="4" name="RA1/ISCPCLK"  />
    <pin index="5" name="RA3/MCLR/VPP" />
    <pin index="6" name="VSS"          />
    <pin index="7" name="N/C"          />
    <pin index="8" name="RA0/ISCPDAT"  />
  </package>

  <package types="sot23" nb_pins="6" >
    <pin index="1" name="RA0/ISCPDAT"  />
    <pin index="2" name="VSS"          />
    <pin index="3" name="RA2"          />
    <pin index="4" name="RA1/ISCPCLK"  />
    <pin index="5" name="VDD"          />
    <pin index="6" name="RA3/MCLR/VPP" />
  </package>

</device>
