<?xml version="1.0" encoding="UTF-8"?>
<!--************************************************************************-->
<!--* Copyright (C) 2010 Nicolas Hadacek <hadacek@kde.org>                 *-->
<!--*                                                                      *-->
<!--* This program is free software; you can redistribute it and/or modify *-->
<!--* it under the terms of the GNU General Public License as published by *-->
<!--* the Free Software Foundation; either version 2 of the License, or    *-->
<!--* (at your option) any later version.                                  *-->
<!--************************************************************************-->
<device name="16F724" status="IP" memory_technology="FLASH" self_write="no" architecture="midrange" id="0x1840"
        xmlns:xsi='http://www.w3.org/2001/XMLSchema-instance'
        xsi:noNamespaceSchemaLocation='pic.xsd'>

<!--* Documents ************************************************************-->
  <documents webpage="533509" datasheet="41341" progsheet="41332" erratas="80382" />

<!--* Checksums ************************************************************-->
<!--  <checksums>
    <checksum protected="Off" bchecksum="0xF85F" cchecksum="0x842D" />
    <checksum protected="All" bchecksum="0x005E" cchecksum="0x005E" />
  </checksums>
-->
<!--* Operating characteristics ********************************************-->
  <frequency_range name="extended" special="low_power" >
    <frequency start="0"  end="16" vdd_min="1.8" vdd_max="3.6" />
    <frequency start="16" end="20" vdd_min="2.3" vdd_max="3.6" />
  </frequency_range>
  <frequency_range name="extended"   >
    <frequency start="0"  end="16" vdd_min="1.8" vdd_max="5.5" />
    <frequency start="16" end="20" vdd_min="2.3" vdd_max="5.5" />
  </frequency_range>

  <voltages name="vpp"           min="8.0" max="9.0" nominal="8.5" />
  <voltages name="vdd_prog"      min="2.7" max="5.5" nominal="5.0"  />

<!--* Memory ***************************************************************-->
  <memory name="code"         start="0x0000" end="0x0FFF" />
  <memory name="user_ids"     start="0x2000" end="0x2003" rmask="0x000F" />
  <memory name="debug_vector" start="0x2004" end="0x2004" />
  <memory name="device_id"    start="0x2006" end="0x2006" />
  <memory name="config"       start="0x2007" end="0x2008" />
  <memory name="calibration"  start="0x2009" end="0x200A" cal_opcode="0x0000" cal_opmask="0x0000" />

<!--* Configuration bits ***************************************************-->
  <config offset="0x0" name="CONFIG1" wmask="0x3FFF" bvalue="0x3740" >
    <mask name="FOSC"  value="0x0007" >
      <value value="0x0000" name="LP"           def="_LP_OSC" />
      <value value="0x0001" name="XT"           def="_XT_OSC" />
      <value value="0x0002" name="HS"           def="_HS_OSC" />
      <value value="0x0003" name="EC_IO"        def="_EC_OSC" />
      <value value="0x0004" name="INTRC_IO"     def="_INTRC_OSC_NOCLKOUT _INTOSCIO" />
      <value value="0x0005" name="INTRC_CLKOUT" def="_INTRC_OSC_CLKOUT _INTOSC" />
      <value value="0x0006" name="EXTRC_IO"     def="_EXTRC_OSC_NOCLKOUT _EXTRCIO" />
      <value value="0x0007" name="EXTRC_CLKOUT" def="_EXTRC_OSC_CLKOUT _EXTRC" />
    </mask>
    <mask name="WDT"   value="0x0008" >
      <value value="0x0000" name="Off" def="_WDT_OFF" />
      <value value="0x0008" name="On"  def="_WDT_ON"  />
    </mask>
    <mask name="PWRTE" value="0x0010" >
      <value value="0x0000" name="On"  def="_PWRT_EN"  />
      <value value="0x0010" name="Off" def="_PWRT_DIS" />
    </mask>
    <mask name="MCLRE" value="0x0020" >
      <value value="0x0000" name="Internal" def="_MCLR_DIS" />
      <value value="0x0020" name="External" def="_MCLR_EN"  />
    </mask>
    <mask name="CP"    value="0x0040" >
      <value value="0x0000" name="All" def="_CP_ON" />
      <value value="0x0040" name="Off" def="_CP_OFF" />
    </mask>
    <mask name="BODEN" value="0x0300" >
      <value value="default" name="Off"    def="_BOR_OFF"    />
      <value value="0x0200"  name="On_run" def="_BOR_NSLEEP" />
      <value value="0x0300"  name="On"     def="_BOR_ON"     />
    </mask>
    <mask name="BORV"  value="0x0400" >
      <value value="0x0000" name="2.5" def="_BORV_2_5" />
      <value value="0x0400" name="1.9" def="_BORV_1_9" />
    </mask>
    <mask name="PLLEN" value="0x1000" >
      <value value="0x0000" name="Off" def="_PLL_DIS" />
      <value value="0x1000" name="On"  def="_PLL_EN" />
    </mask>
    <mask name="DEBUG" value="0x2000" >
      <value value="0x0000" name="On"  def="_DEBUG_ON"  />
      <value value="0x2000" name="Off" def="_DEBUG_OFF" />
    </mask>
  </config>

  <config offset="0x1" name="CONFIG2" wmask="0x3FFF" bvalue="0x0030" >
    <mask name="VCAP" value="0x0030" >
      <value value="0x0000" name="RA0"  def="_VCAP_RA0" />
      <value value="0x0010" name="RA5"  def="_VCAP_RA5" />
      <value value="0x0020" name="RA6"  def="_VCAP_RA6" />
      <value value="0x0030" name="Off"  def="_VCAP_DIS" />
    </mask>
  </config>

<!--* Packages *************************************************************-->
  <package types="pdip" nb_pins="40" >
    <pin index="1"  name="" />
    <pin index="2"  name="" />
    <pin index="3"  name="" />
    <pin index="4"  name="" />
    <pin index="5"  name="" />
    <pin index="6"  name="" />
    <pin index="7"  name="" />
    <pin index="8"  name="" />
    <pin index="9"  name="" />
    <pin index="10" name="" />
    <pin index="11" name="" />
    <pin index="12" name="" />
    <pin index="13" name="" />
    <pin index="14" name="" />
    <pin index="15" name="" />
    <pin index="16" name="" />
    <pin index="17" name="" />
    <pin index="18" name="" />
    <pin index="19" name="" />
    <pin index="20" name="" />
    <pin index="21" name="" />
    <pin index="22" name="" />
    <pin index="23" name="" />
    <pin index="24" name="" />
    <pin index="25" name="" />
    <pin index="26" name="" />
    <pin index="27" name="" />
    <pin index="28" name="" />
    <pin index="29" name="" />
    <pin index="30" name="" />
    <pin index="31" name="" />
    <pin index="32" name="" />
    <pin index="33" name="" />
    <pin index="34" name="" />
    <pin index="35" name="" />
    <pin index="36" name="" />
    <pin index="37" name="" />
    <pin index="38" name="" />
    <pin index="39" name="" />
    <pin index="40" name="" />
  </package>

  <package types="tqfp" nb_pins="44" >
    <pin index="1"  name="" />
    <pin index="2"  name="" />
    <pin index="3"  name="" />
    <pin index="4"  name="" />
    <pin index="5"  name="" />
    <pin index="6"  name="" />
    <pin index="7"  name="" />
    <pin index="8"  name="" />
    <pin index="9"  name="" />
    <pin index="10" name="" />
    <pin index="11" name="" />
    <pin index="12" name="" />
    <pin index="13" name="" />
    <pin index="14" name="" />
    <pin index="15" name="" />
    <pin index="16" name="" />
    <pin index="17" name="" />
    <pin index="18" name="" />
    <pin index="19" name="" />
    <pin index="20" name="" />
    <pin index="21" name="" />
    <pin index="22" name="" />
    <pin index="23" name="" />
    <pin index="24" name="" />
    <pin index="25" name="" />
    <pin index="26" name="" />
    <pin index="27" name="" />
    <pin index="28" name="" />
    <pin index="29" name="" />
    <pin index="30" name="" />
    <pin index="31" name="" />
    <pin index="32" name="" />
    <pin index="33" name="" />
    <pin index="34" name="" />
    <pin index="35" name="" />
    <pin index="36" name="" />
    <pin index="37" name="" />
    <pin index="38" name="" />
    <pin index="39" name="" />
    <pin index="40" name="" />
    <pin index="41" name="" />
    <pin index="42" name="" />
    <pin index="43" name="" />
    <pin index="44" name="" />
  </package>

</device>
