<?xml version="1.0" encoding="UTF-8"?>
<!--************************************************************************-->
<!--* Copyright (C) 2005-2010 Nicolas Hadacek <hadacek@kde.org>            *-->
<!--*                                                                      *-->
<!--* This program is free software; you can redistribute it and/or modify *-->
<!--* it under the terms of the GNU General Public License as published by *-->
<!--* the Free Software Foundation; either version 2 of the License, or    *-->
<!--* (at your option) any later version.                                  *-->
<!--************************************************************************-->
<device name="16F526" status="IP" memory_technology="FLASH" architecture="baseline" pc="11"
        xmlns:xsi='http://www.w3.org/2001/XMLSchema-instance'
        xsi:noNamespaceSchemaLocation='pic.xsd'>

<!--* Documents ************************************************************-->
  <documents webpage="530189" datasheet="41326" progsheet="41317" erratas="" />

<!--* Checksums ************************************************************-->
  <checksums>
    <checksum protected="Off"     bchecksum="0xED00" cchecksum="0xDB48" />
    <checksum protected="040:3FE" bchecksum="0xEDAF" cchecksum="0xD31B" />
  </checksums>

<!--* Operating characteristics ********************************************-->
  <frequency_range name="extended" >
    <frequency start="0"  end="4"  vdd_min="2"   vdd_max="5.5" />
    <frequency start="4"  end="10" vdd_min="3"   vdd_max="5.5" />
    <frequency start="10" end="20" vdd_min="4.5" vdd_max="5.5" />
  </frequency_range>

  <voltages name="vpp"      min="12.5" max="13.5" nominal="13" />
  <voltages name="vdd_prog" min="4.5"  max="5.5"  nominal="5"  />

<!--* Memory ***************************************************************-->
  <memory name="code"               start="0x000" end="0x3FE" />
  <memory name="calibration"        start="0x3FF" end="0x3FF" cal_opmask="0xF00"     cal_opcode="0xC00" />
  <memory name="eeprom"             start="0x400" end="0x43F" />
  <memory name="user_ids"           start="0x440" end="0x443" rmask="0x00F"          />
  <memory name="config"             start="0x7FF" end="0x7FF" hexfile_offset="0xFFF" />
  <memory name="calibration_backup" start="0x444" end="0x447" />

<!--* Configuration bits ***************************************************-->
  <config offset="0x0" name="" wmask="0xFFF" bvalue="0x0FF" >
    <mask name="FOSC"   value="0x007" >
      <value value="0x000" name="LP"           def="_LP_OSC"             />
      <value value="0x001" name="XT"           def="_XT_OSC"             />
      <value value="0x002" name="HS"           def="_HS_OSC"             />
      <value value="0x003" name="EC_IO"        def="_EC_OSC"             />
      <value value="0x004" name="INTRC_IO"     def="_IntRC_OSC_RB4EN"    />
      <value value="0x005" name="INTRC_CLKOUT" def="_IntRC_OSC_CLKOUTEN" />
      <value value="0x006" name="EXTRC_IO"     def="_ExtRC_OSC_RB4EN"    />
      <value value="0x007" name="EXTRC_CLKOUT" def="_ExtRC_OSC_CLKOUTEN" />
    </mask>
    <mask name="WDT"    value="0x008" >
      <value value="0x000" name="Off" def="_WDT_OFF" />
      <value value="0x008" name="On"  def="_WDT_ON"  />
    </mask>
    <mask name="CP"     value="0x010" >
      <value value="0x000" name="040:3FE" def="_CP_ON"  />
      <value value="0x010" name="Off"     def="_CP_OFF" />
    </mask>
    <mask name="MCLRE"  value="0x020" >
      <value value="0x000" name="Internal" def="_MCLRE_OFF" />
      <value value="0x020" name="External" def="_MCLRE_ON"  />
    </mask>
    <mask name="IOSCFS" value="0x040" >
      <value value="0x000" name="4MHZ" def="_IOSCFS_4MHZ" />
      <value value="0x040" name="8MHZ" def="_IOSCFS_8MHZ"  />
    </mask>
    <mask name="CPD"    value="0x080" >
      <value value="0x000" name="All" def="_CPDF_ON"  />
      <value value="0x080" name="Off" def="_CPDF_OFF" />
    </mask>
  </config>

<!--* Packages *************************************************************-->
  <package types="pdip soic tssop" nb_pins="14" >
    <pin index="1"  name="VDD"                   />
    <pin index="2"  name="RB5/OSC1/CLKIN"        />
    <pin index="3"  name="RB4/OSC2/CLKOUT"       />
    <pin index="4"  name="RB3/MCLR/VPP"          />
    <pin index="5"  name="RC5/T0CKI"             />
    <pin index="6"  name="RC4/C2OUT"             />
    <pin index="7"  name="RC3"                   />
    <pin index="8"  name="RC2/CVREF"             />
    <pin index="9"  name="RC1/C2IN-"             />
    <pin index="10" name="RC0/C2IN+"             />
    <pin index="11" name="RB2/AN2/C1OUT"         />
    <pin index="12" name="RB1/AN1/C1IN-/ICSPCLK" />
    <pin index="13" name="RB0/AN0/C1IN+/ICSPDAT" />
    <pin index="14" name="VSS"                   />
  </package>

  <package types="qfn" nb_pins="16" >
  </package>

</device>
