<?xml version="1.0" encoding="UTF-8"?>
<!--************************************************************************-->
<!--* Copyright (C) 2005-2007 Nicolas Hadacek <hadacek@kde.org>            *-->
<!--*                                                                      *-->
<!--* This program is free software; you can redistribute it and/or modify *-->
<!--* it under the terms of the GNU General Public License as published by *-->
<!--* the Free Software Foundation; either version 2 of the License, or    *-->
<!--* (at your option) any later version.                                  *-->
<!--************************************************************************-->
<device name="16C781" document="010178" status="NR"
        memory_technology="EPROM" architecture="midrange" id="0x0D40"
        xmlns:xsi='http://www.w3.org/2001/XMLSchema-instance'
        xsi:noNamespaceSchemaLocation='pic.xsd'>

<!--* Checksums ************************************************************-->
  <checksums>
    <checksum protected="Off"     bchecksum="0x3B7F" cchecksum="0x074D" />
    <checksum protected="All"     bchecksum="0x47FE" cchecksum="0x13CC" />
  </checksums>

<!--* Operating characteristics ********************************************-->
  <frequency_range name="industrial" >
    <frequency start="0" end="4"  vdd_min="4"   vdd_max="5.5" />
    <frequency start="4" end="20" vdd_min="4.5" vdd_max="5.5" />
  </frequency_range>
  <frequency_range name="industrial" special="low_power" >
    <frequency start="0" end="4"  vdd_min="2.7" vdd_max="5.5" />
    <frequency start="4" end="20" vdd_min="4.5" vdd_max="5.5" />
  </frequency_range>

  <voltages name="vpp"      min="12.75" max="13.25" nominal="13" />
  <voltages name="vdd_prog" min="4.75"  max="5.25"  nominal="5"  />

<!--* Memory ***************************************************************-->
  <memory name="code"   start="0x0000" end="0x03FF" />
  <memory name="user_ids"  start="0x2000" end="0x2003" rmask="0x007F" />
  <memory name="device_id" start="0x2006" end="0x2006" />
  <memory name="config"    start="0x2007" end="0x2007" />

<!--* Configuration bits ***************************************************-->
  <config offset="0x0" name="" wmask="0x3FFF" bvalue="0x3F7F" >
    <mask name="FOSC"  value="0x0007" >
      <value value="0x0000" name="LP"           def="_LP_OSC"             />
      <value value="0x0001" name="XT"           def="_XT_OSC"             />
      <value value="0x0002" name="HS"           def="_HS_OSC"             />
      <value value="0x0003" name="EC_IO"        def="_EXTCLK_OSC"         />
      <value value="0x0004" name="INTRC_IO"     def="_INTRC_OSC_NOCLKOUT" />
      <value value="0x0005" name="INTRC_CLKOUT" def="_INTRC_OSC_CLKOUT"   />
      <value value="0x0006" name="ER_IO"        def="_ER_OSC_NOCLKOUT"    />
      <value value="0x0007" name="ER_CLKOUT"    def="_ER_OSC_CLKOUT"      />
    </mask>
    <mask name="WDT"   value="0x0008" >
      <value value="0x0000" name="Off" def="_WDT_OFF" />
      <value value="0x0008" name="On"  def="_WDT_ON"  />
    </mask>
    <mask name="PWRTE" value="0x0010" >
      <value value="0x0000" name="On"  def="_PWRTE_ON"  />
      <value value="0x0010" name="Off" def="_PWRTE_OFF" />
    </mask>
    <mask name="MCLRE" value="0x0020" >
      <value value="0x0000" name="Internal" def="_MCLRE_OFF" />
      <value value="0x0020" name="External" def="_MCLRE_ON"  />
    </mask>
    <mask name="BODEN" value="0x0040" >
      <value value="0x0000" name="Off" def="_BODEN_OFF" />
      <value value="0x0040" name="On"  def="_BODEN_ON"  />
    </mask>
    <mask name="BORV"  value="0x0C00" >
      <value value="0x0000" name="4.5" def="_VBOR_45" />
      <value value="0x0400" name="4.2" def="_VBOR_42" />
      <value value="0x0800" name="2.7" def="_VBOR_27" />
      <value value="0x0C00" name="2.5" def="_VBOR_25" />
    </mask>
    <mask name="CP"    value="0x3300" >
      <value value="0x0000" name="All" def="_CP_ALL" />
      <value value="0x3300" name="Off" def="_CP_OFF" />
      <value value="default" name="invalid" />
    </mask>
  </config>

<!--* Packages *************************************************************-->
  <package types="pdip soic ssop" nb_pins="20" >
    <pin index="1"  name="" />
    <pin index="2"  name="" />
    <pin index="3"  name="" />
    <pin index="4"  name="" />
    <pin index="5"  name="" />
    <pin index="6"  name="" />
    <pin index="7"  name="" />
    <pin index="8"  name="" />
    <pin index="9"  name="" />
    <pin index="10" name="" />
    <pin index="11" name="" />
    <pin index="12" name="" />
    <pin index="13" name="" />
    <pin index="14" name="" />
    <pin index="15" name="" />
    <pin index="16" name="" />
    <pin index="17" name="" />
    <pin index="18" name="" />
    <pin index="19" name="" />
    <pin index="20" name="" />
  </package>

</device>
