<?xml version="1.0" encoding="UTF-8"?>
<!--************************************************************************-->
<!--* Copyright (C) 2011 Gal Zsolt                                         *-->
<!--*                                                                      *-->
<!--* This program is free software; you can redistribute it and/or modify *-->
<!--* it under the terms of the GNU General Public License as published by *-->
<!--* the Free Software Foundation; either version 2 of the License, or    *-->
<!--* (at your option) any later version.                                  *-->
<!--************************************************************************-->
<device name="16F1507" status="IP" memory_technology="FLASH" self_write="yes"
        architecture="emidrange" id="0x2D00" id_low_power="0x2DC0"
        xmlns:xsi='http://www.w3.org/2001/XMLSchema-instance'
        xsi:noNamespaceSchemaLocation='pic.xsd'>

<!--* Documents ************************************************************-->
  <documents webpage="553468" datasheet="41586" progsheet="41573" erratas="" />

<!--* Checksums ************************************************************-->

<!--* Operating characteristics ********************************************-->
  <frequency_range name="extended" >
    <frequency start="0"  end="16" vdd_min="2.3" vdd_max="5.5" />
    <frequency start="16" end="32" vdd_min="2.5" vdd_max="5.5" />
  </frequency_range>
  <frequency_range name="extended" special="low_power" >
    <frequency start="0"  end="16" vdd_min="1.8" vdd_max="3.6" />
    <frequency start="16" end="32" vdd_min="2.5" vdd_max="3.6" />
  </frequency_range>

  <voltages name="vpp"            min="8.0" max="9.0" nominal="9.0" />
  <voltages name="vdd_prog"       min="2.7" max="5.5" nominal="5.0"  />
  <voltages name="vdd_prog_write" min="2.7" max="5.5" nominal="5.0"  />

<!--* Memory ***************************************************************-->
  <memory name="code"         start="0x0000" end="0x07FF" />
  <memory name="user_ids"     start="0x8000" end="0x8003" rmask="0x3FFF"          />
  <memory name="debug_vector" start="0x8004" end="0x8004" />
  <memory name="device_id"    start="0x8006" end="0x8006" />
  <memory name="config"       start="0x8007" end="0x8008" />
  <memory name="calibration"  start="0x8009" end="0x800A" cal_opmask="0x0000" cal_opcode="0x0000" />

<!--* Configuration bits ***************************************************-->
  <config offset="0x0" name="CONFIG1" wmask="0x3FFF" bvalue="0x3FFF" >
    <mask name="FOSC"  value="0x0003" >
      <value value="0x0000" name="LP"       def="_FOSC_INTOSC"     />
      <value value="0x0001" name="XT"       def="_FOSC_ECL"     />
      <value value="0x0002" name="HS"       def="_FOSC_ECM"     />
      <value value="0x0003" name="EC_IO"    def="_FOSC_ECH"  />
    </mask>
    <mask name="WDT"   value="0x0018" >
      <value value="0x0000" name="Off"      def="_WDTE_OFF"    />
      <value value="0x0008" name="Software" def="_WDTE_SWDTEN" />
      <value value="0x0010" name="On_run"   def="_WDTE_NSLEEP" />
      <value value="0x0018" name="On"       def="_WDTE_ON"     />
    </mask>
    <mask name="PWRTE" value="0x0020" >
      <value value="0x0000" name="On"  def="_PWRTE_ON"  />
      <value value="0x0020" name="Off" def="_PWRTE_OFF" />
    </mask>
    <mask name="MCLRE" value="0x0040" >
      <value value="0x0000" name="Internal" def="_MCLRE_OFF" />
      <value value="0x0040" name="External" def="_MCLRE_ON"  />
    </mask>

    <mask name="CP"    value="0x0080" >
      <value value="0x0000" name="All" def="_CP_ON"  />
      <value value="0x0080" name="Off" def="_CP_OFF" />
    </mask>
    <mask name="BODEN" value="0x0600" >
      <value value="0x0000" name="Off"      def="_BOREN_OFF"    />
      <value value="0x0200" name="Software" def="_BOREN_SBODEN" />
      <value value="0x0400" name="On_run"   def="_BOREN_NSLEEP" />
      <value value="0x0600" name="On"       def="_BOREN_ON"     />
    </mask>
    <mask name="CLKOUTEN"  value="0x0800" >
      <value value="0x0000" name="On"   def="_CLKOUTEN_ON"  />
      <value value="0x0800" name="Off"  def="_CLKOUTEN_OFF" />
    </mask>
  </config>

  <config offset="0x1" name="CONFIG2" wmask="0x3FFF" bvalue="0x2E03" >
    <mask name="WRT"  value="0x0003" >
      <value value="0x0000" name="0000:07FF" def="_WRT_ALL"  />
      <value value="0x0001" name="0000:03FF" def="_WRT_HALF" />
      <value value="0x0002" name="0000:01FF" def="_WRT_BOOT" />
      <value value="0x0003" name="Off"       def="_WRT_OFF"  />
    </mask>
    <mask name="STVREN"   value="0x0200" >
      <value value="0x0000" name="Off" def="_STVREN_OFF" />
      <value value="0x0200" name="On"  def="_STVREN_ON"  />
    </mask>
    <mask name="BORV" value="0x0400" >
      <value value="0x0400" name="1.9" def="_BORV_19" />
      <value value="0x0000" name="2.5" def="_BORV_25" />
    </mask>

<!-- NOT_LPBOR is missing here 0x0000 and 0x00800 -->

    <mask name="DEBUG" value="0x1000" >
      <value value="0x0000" name="On"  def="_DEBUG_ON"  />
      <value value="0x1000" name="Off" def="_DEBUG_OFF" />
    </mask>
    <mask name="LVP"   value="0x2000" >
      <value value="0x0000" name="Off" def="_LVP_OFF" />
      <value value="0x2000" name="On"  def="_LVP_ON"  />
    </mask>
  </config>

<!--* Packages *************************************************************-->
  <package types="pdip ssop soic" nb_pins="20" >
    <pin index="1"  name="VDD" />
    <pin index="2"  name="RA5/CLKIN/T1CKI/NCO1CLK" />
    <pin index="3"  name="RA4/AN3/CLKOUT/T1G" />
    <pin index="4"  name="RA3/NOT_MCLR/VPP/CLC1IN0" />
    <pin index="5"  name="RC5/CCP1/CWG1A" />
    <pin index="6"  name="RC4/CWG1B/CLC2IN1" />
    <pin index="7"  name="RC3/AN7/CCP2/CLC2IN0" />
    <pin index="8"  name="RC6/AN8/CPS8" />
    <pin index="9"  name="RC7/AN9/CLC1IN1" />
    <pin index="10" name="RB7" />
    <pin index="11" name="RB6" />
    <pin index="12" name="RB5/AN11" />
    <pin index="13" name="RB4/AN10" />
    <pin index="14" name="RC2/AN6" />
    <pin index="15" name="RC1/AN5/CCP4/NCO1" />
    <pin index="16" name="RC0/AN4/CLC2" />
    <pin index="17" name="RA2/AN2/T0CKI/INT/CCP3/NOT_CWG1FLT/CLC1" />
    <pin index="18" name="RA1/AN1/VREF+/ICSPCLK" />
    <pin index="19" name="RA0/AN0/ICSPDAT" />
    <pin index="20" name="VSS" />
  </package>

  <package types="qfn" nb_pins="20" >
    <pin index="1"  name="RA3/NOT_MCLR/VPP/CLC1IN0" />
    <pin index="2"  name="RC5/CCP1/CWG1A" />
    <pin index="3"  name="RC4/CWG1B/CLC2IN1" />
    <pin index="4"  name="RC3/AN7/CCP2/CLC2IN0" />
    <pin index="5"  name="RC6/AN8/CPS8" />
    <pin index="6"  name="RC7/AN9/CLC1IN1" />
    <pin index="7"  name="RB7" />
    <pin index="8"  name="RB6" />
    <pin index="9"  name="RB5/AN11" />
    <pin index="10" name="RB4/AN10" />
    <pin index="11" name="RC2/AN6" />
    <pin index="12" name="RC1/AN5/CCP4/NCO1" />
    <pin index="13" name="RC0/AN4/CLC2" />
    <pin index="14" name="RA2/AN2/T0CKI/INT/CCP3/NOT_CWG1FLT/CLC1" />
    <pin index="15" name="RA1/AN1/VREF+/ICSPCLK" />
    <pin index="16" name="RA0/AN0/ICSPDAT" />
    <pin index="17" name="VSS" />
    <pin index="18" name="VDD" />
    <pin index="19" name="RA5/CLKIN/T1CKI/NCO1CLK" />
    <pin index="20" name="RA4/AN3/CLKOUT/T1G" />
  </package>


</device>
