<?xml version="1.0" encoding="UTF-8"?>
<!--************************************************************************-->
<!--* Copyright (C) 2012 Nicolas Hadacek <hadacek@kde.org>                 *-->
<!--*                                                                      *-->
<!--* This program is free software; you can redistribute it and/or modify *-->
<!--* it under the terms of the GNU General Public License as published by *-->
<!--* the Free Software Foundation; either version 2 of the License, or    *-->
<!--* (at your option) any later version.                                  *-->
<!--************************************************************************-->
<device name="12F752" status="IP" memory_technology="FLASH" self_write="yes"
        architecture="midrange" id="0x1500" id_high_voltage="0x1520"
        xmlns:xsi='http://www.w3.org/2001/XMLSchema-instance'
        xsi:noNamespaceSchemaLocation='pic.xsd'>

<!--* Documents ************************************************************-->
  <documents webpage="552818" datasheet="41576" progsheet="41561" erratas="80535" />

<!--* Checksums ************************************************************-->
  <checksums>
    <checksum protected="Off" bchecksum="0x3B79" cchecksum="0x0747" />
    <checksum protected="All" bchecksum="0x966B" cchecksum="0x0000" />
  </checksums>

<!--* Operating characteristics ********************************************-->
  <frequency_range name="extended" >
    <frequency start="0"  end="8"  vdd_min="2.0" vdd_max="5.5" />
    <frequency start="8"  end="10" vdd_min="3.0" vdd_max="5.5" />
    <frequency start="10" end="20" vdd_min="4.5" vdd_max="5.5" />
  </frequency_range>

  <frequency_range name="extended" special="high_voltage" >
    <frequency start="0"  end="8"  vdd_min="2.0" vdd_max="5.0" />
    <frequency start="8"  end="10" vdd_min="3.0" vdd_max="5.0" />
    <frequency start="10" end="20" vdd_min="4.0" vdd_max="5.0" />
  </frequency_range>

  <voltages name="vpp"            min="10"  max="13"  nominal="11.5" />
  <voltages name="vdd_prog"       min="4.5" max="5.5" nominal="5"    />
  <voltages name="vdd_prog_write" min="2"   max="5.5" nominal="5"    />

<!--* Memory ***************************************************************-->
  <memory name="code"         start="0x0000" end="0x03FF" />
  <memory name="calibration"  start="0x2008" end="0x2009" cal_opmask="0x0000" cal_opcode="0x0000" />
  <memory name="user_ids"     start="0x2000" end="0x2003" rmask="0x007F"      />
  <memory name="device_id"    start="0x2006" end="0x2006" />
  <memory name="config"       start="0x2007" end="0x2007" />
  <memory name="debug_vector" start="0x2004" end="0x2004" />

<!--* Configuration bits ***************************************************-->
  <config offset="0x0" name="" wmask="0x3FFF" bvalue="0x3FFF" >
    <mask name="FOSC"   value="0x0001" >
      <value value="0x0000" name="INTRC" def="_FOSC0_INT" />
      <value value="0x0001" name="EC"    def="_FOSC0_EC"  />
    </mask>
    <mask name="WDT"    value="0x0008" >
      <value value="0x0000" name="Off" def="_WDT_OFF" />
      <value value="0x0008" name="On"  def="_WDT_ON"  />
    </mask>
    <mask name="PWRTE"  value="0x0010" >
      <value value="0x0000" name="On"  def="_PWRTE_ON"  />
      <value value="0x0010" name="Off" def="_PWRTE_OFF" />
    </mask>
    <mask name="MCLRE"  value="0x0020" >
      <value value="0x0000" name="Internal" def="_MCLRE_OFF" />
      <value value="0x0020" name="External" def="_MCLRE_ON"  />
    </mask>
    <mask name="CP"     value="0x0040" >
      <value value="0x0000" name="All" def="_CP_ON"  />
      <value value="0x0040" name="Off" def="_CP_OFF" />
    </mask>
    <mask name="BODEN"  value="0x0300" >
      <value value="default" name="Off"    def="_BOREN_DIS"    />
      <value value="0x0200"  name="On_run" def="_BOREN_SLEEP_DIS" />
      <value value="0x0300"  name="On"     def="_BOREN_EN"     />
    </mask>
    <mask name="WRT"    value="0x0C00" >
      <value value="0x0000" name="0000:03FF" def="_WRT_ALL"  />
      <value value="0x0400" name="0000:01FF" def="_WRT_HALF" />
      <value value="0x0800" name="0000:00FF" def="_WRT_BOOT" />
      <value value="0x0C00" name="Off"       def="_WRT_OFF"  />
    </mask>
    <mask name="CLKOUTEN" value="0x1000" >
      <value value="0x0000" name="On"  def="_CLKOUTEN_ON"  />
      <value value="0x1000" name="Off" def="_CLKOUTEN_OFF" />
    </mask>
    <mask name="DEBUG" value="0x2000" >
      <value value="0x0000" name="On"  def="_DEBUG_ON"  />
      <value value="0x2000" name="Off" def="_DEBUG_OFF" />
    </mask>
  </config>

<!--* Packages *************************************************************-->
  <package types="pdip soic dfn" nb_pins="8" >
    <pin index="1" name="VDD" />
    <pin index="2" name="RA5" />
    <pin index="3" name="RA4" />
    <pin index="4" name="RA3/MCLR/VPP" />
    <pin index="5" name="RA2" />
    <pin index="6" name="RA1/ISCPCLK" />
    <pin index="7" name="RA0/ISCPDAT" />
    <pin index="8" name="VSS" />
  </package>

</device>
